ID,up__ID,timestamp,author,message
c001,inc001,2023-01-01T08:00:00Z,Ana Silva,Verifique se o cabo está conectado corretamente.
c002,inc001,2023-01-01T09:15:00Z,Carlos Lima,O problema parece estar na fonte de energia.
c003,inc002,2023-01-02T10:30:00Z,Emily Elizabeth,Já tentou reiniciar o equipamento?
c004,inc002,2023-01-02T11:45:00Z,Daniel Watts,Reinicialização feita, mas sem sucesso.
c005,inc003,2023-01-03T12:00:00Z,Sunny Sunshine,Verifique se há atualizações pendentes.
c006,inc003,2023-01-03T13:20:00Z,Bradley Flowers,Atualizações aplicadas, erro persiste.
c007,inc004,2023-01-04T14:00:00Z,Harry John,Conexão de rede instável detectada.
c008,inc004,2023-01-04T15:10:00Z,Stormy Weathers,Reconfiguração de rede realizada.
c009,inc005,2023-01-05T16:30:00Z,Ana Silva,Verifique se o sensor está limpo.
c010,inc005,2023-01-05T17:45:00Z,Carlos Lima,Sensor limpo, funcionamento normal.
c011,inc006,2023-01-06T08:00:00Z,Emily Elizabeth,Erro de autenticação no sistema.
c012,inc006,2023-01-06T09:15:00Z,Daniel Watts,Senha redefinida com sucesso.
c013,inc007,2023-01-07T10:30:00Z,Sunny Sunshine,Verifique se há conflitos de IP.
c014,inc007,2023-01-07T11:45:00Z,Bradley Flowers,IP ajustado, conexão estável.
c015,inc008,2023-01-08T12:00:00Z,Harry John,Problema com driver da impressora.
c016,inc008,2023-01-08T13:20:00Z,Stormy Weathers,Driver atualizado, impressão normal.
c017,inc009,2023-01-09T14:00:00Z,Ana Silva,Erro de sincronização com servidor.
c018,inc009,2023-01-09T15:10:00Z,Carlos Lima,Sincronização manual realizada.
c019,inc010,2023-01-10T16:30:00Z,Emily Elizabeth,Verifique se há falha de hardware.
c020,inc010,2023-01-10T17:45:00Z,Daniel Watts,Hardware substituído, sistema ok.
c021,inc011,2023-01-11T08:00:00Z,Sunny Sunshine,Problema com acesso remoto.
c022,inc011,2023-01-11T09:15:00Z,Bradley Flowers,Acesso remoto liberado.
c023,inc012,2023-01-12T10:30:00Z,Harry John,Erro de leitura no disco.
c024,inc012,2023-01-12T11:45:00Z,Stormy Weathers,Disco substituído com sucesso.
c025,inc013,2023-01-13T12:00:00Z,Ana Silva,Verifique se há interferência de sinal.
c026,inc013,2023-01-13T13:20:00Z,Carlos Lima,Sinal estabilizado após ajuste.
c027,inc014,2023-01-14T14:00:00Z,Emily Elizabeth,Problema com autenticação biométrica.
c028,inc014,2023-01-14T15:10:00Z,Daniel Watts,Biometria reconfigurada.
c029,inc015,2023-01-15T16:30:00Z,Sunny Sunshine,Erro de inicialização do sistema.
c030,inc015,2023-01-15T17:45:00Z,Bradley Flowers,Inicialização normal após limpeza de cache.